ID,question,intention
0,hello i m wa wrong forum for my question so i base here i took for the first time yesterday paroxetin and thi morn it is a disast tingl all attorney in the annunci bodi cold sweat veri veri massiv and vomit im two crise sinc 5 hour mat thi seem to spend my normal rest my hand sweati and hot estc first thank you all,28
1,is what the motilium reliev me against nausea,31
2,my doctor prescrib adenyl 2nd stamp of terribl headach and 3rd palpit cold sweat intens heat in the head shake tingl in the upper lip difficulti breath after stop the drug all the symptom have disappear is thi alreadi happen to someon,28
3,is there a form adapt to the child of 5 year of micropakin,44
4,my doctor treat me to a rhino pharingit and prescrib amoxicillin as the anti biotic is it realli for thi indic,31
5,i just learn that im enceintesavez sure if i can continu rubozinc,44
6,atrax it is not danger in the long term,48
7,i am under mercilon i have nausea and bleed,28
8,atenolol what is it,22
9,i take trinordiol and at the end of my first plate i had my first boyfriend ac min the pill is therefor effect from the begin i have chest pain i feel they have grown a bit more ossifi i hurt o lower ventr i have e or c minkiété simplemen the period dadapt,23
10,laroxyl in low dose for stress,31
11,my therapist told me to take 50mg sertralin the morn and 50 mg of sertralin night 100mg can be taken either in the morn or at noon,42
12,i am under antiobiotiqu for almost a week and i chopé whatev my bitch ca scratch is superfici but it demeng to a point is thi relat to the antibiot,28
13,which vaccin against cervic cancer of the uteru,32
14,epilepsi and havlan,28
15,dtpe vaccin and b hépatir they are possibl dure pregnanc,44
16,i have just been put under androtardyl 1 week i want to know after how mani inject the product began to make it effect and after how mani day after each inject effect were felt,26
17,how to treat dishydros if the dermov and prepar copper sulphat 10mg 10l water bath and dermalibour did not work,0
18,a littl inform about acomplia i took my first stamp thi morn have you had ani side effect,28
19,oroken what risk,48
20,it may take st john wort and bach flower at the same time,34
21,when it end it wafer can we have sex raport,14
22,what is the shelf life of tegretol,7
23,is that the pill trimordiolm fat,28
24,dure the 7 day without take onc the wafer 21pilul complet is it still protect or not that week,37
25,percutaféin can it be use by men,44
26,evra patch start j 4 therefor i am not protect pdt 1 month,23
27,how to take temesta,42
28,seroxat is an antidepress or anxiolyt,4
29,you know how long can thi crisi what are the risk i see a psychlogu sinc my first so almost one year crisi thank you for your light,42
30,a mother receiv prescript montelukast 4mg arrow granul for her babi 5 month she ask whether thi shape is adapt so that the babi doe not eat yet sturdi,44
31,lidocain she help to lose weight,31
32,im suppos to take 600mg but yesterday i took a 300 after take it everi time i wa about to fall asleep jentendai full of voic come from everywher is it possibl that these are hallucin of the irregular of the take of treatment,28
33,what are the side effect of st john wort,28
34,i just start treatment cystin b6 sinc 3 day and i have ga what can i do,11
35,or get vitamin c4,24
36,the clomipramin it can caus hot flash,28
37,the euphytos is urtil for anxieti,31
38,gastrointestin specialist doctor prescrib me lansoprazol my doctor told me préscit olmetec 20 mg for hypertens and sinc i take all qiue reaction form small red spot and veri demeng ambet appear on my right quiss i stop olmetec but the point are not yet parti after 3 day what to do or take,11
39,oscillococcinum bird flu,31
40,dietari supplement natur iron that exist,32
41,i took the pill and trinordiol i forget a pill or i had unprotect sex i have not taken one i forget and i took my last pill normal es that there would be risk of be pregnant,48
42,risperd neurolept,22
43,risk of multipl pregnanc that ith clomid risk girl,48
44,i have strong heartburn i take renni and it doe not bother me you know more éfficac remedi,0
45,i am under lovenox 04 and thi drug is out do you have ani inform as to it avail,24
46,i would like to know the exact area of applic of estreva® 01 gel,14
47,xanax drug famili and nordaz,4
48,what is the risperd,31
49,urbanyl,22
50,you know how long the effect of act lysanxia,23
51,is it danger if i exceed the dose of syrup for cold,48
52,hello i have a rather unusu problem i took my first pill jasminel last friday i took it to 1930 and my period had start in the night of thursday to friday between 22h and midnight i wonder if my pill is alreadi effect or if i took my first pill too late to coincid with the first day of my rule becaus i just have sex in which the condom broke down what do you recommend im risk of pregnanc would it make sens for me to take the morn after pill thank you in advanc lucil,23
53,atarax for anxieti attack,31
54,methotrex origin of compon,40
55,i start mélodia i want to know if i am protect from the first dose,23
56,the price of gener lisinopril 20mg rose suddenli from € 1239 to € 1325 is thi normal,46
57,cefpodoxim is a quinolon,4
58,i just trinordiol resum at 1245 i usual take it to 12h30il seem to have understood the need to resum it at the same time after 7 day off there there will be a risk,48
59,can we cut the tablet seropram,30
60,i would like to take the pill jasmin but im so afraid of gain weight which pill is not to be suppos to gain weight,28
61,abilifi what is it effect on on which receiv,37
62,effexor 75 2 x 100 mg per day surmontil quen do you think,42
63,my mother ha oeudèm the ankl and foot sole wa prescrib amlor and tenoret how long befor it leav,23
64,xanax or valium without prescript,8
65,when is take novonorm,38
66,how long for us it feel increas dose valium,23
67,hello i take effexor for a week and a half i am also veri hoars and tire see besot especi in the afternoon i have troubl know if it the medicin but i feel is thi a common symptom and especi is it out by con i feel to have been less depress from day one i even fear lose my emot thi is it possibl could someon help me,28
68,sterogyl onli for adutl,42
69,hello im take a daili pill that sppell gen there is a problem is that my breast is still swollen and it make me ill my doctor prescrib me jasminel but it seem that it is possibl to have bleed in the prennant whi thi is so and that my breast will becom normal uqe becaus it make realli badli thank you veri much,28
70,solian stun me is thi normal,28
71,pregnant and flu vaccin,44
72,im in seroxat and i suffer from dri eye is thi current,28
73,someon he had even at the begin of jasmin a huge outbreak of acn,28
74,i wa take the pill ludéal gen for nearli 8 year i recent chang to leeloo but today i have symptom of nervous depress abdomin fat and nausea what do you think of all thi,28
75,i would like to know the price of human wormer,46
76,i take jasmin i have weird rule is usual with thi medicin,28
77,are there medic against agoraphobia,32
78,forgotten pill microv relationship oblivion tonight,13
79,help ixprim addict,11
80,what can i substitut for engerix,0
81,a girlfriend suffer from heel spur sinc octob do you know of treatment that work,32
82,t it is a drug that bit m help calm the anxieti becaus prozac doe not realli calm,0
83,stop the mepronizin what effect,21
84,can i stop microv dure my plate,14
85,patient with methotrex,28
86,what cream for genit mycosi can i have in pharmaci without a prescript,32
87,one can wear a patch evra continu,15
88,the efferalgan is compat with pregnanc,44
89,i would like to know the virtu of st john wort he promot memori,31
90,hello i woke up sunday morn with hive on the leg and a bit on the arm i went to my doctor yesterday he deduc that it wa an allergi to stresam i stop my treatment on sunday morn and prescrib poralamin i took 2 last night but when i woke up thi morn i saw that i had now hive on the neck and arm and hand it is less import than the leg but still i am concern is it normal for hive continu to climb despit poralamin should i fear a angioedema thank you,27
91,i want to know if betaserc serc lectil and have the same molecul,5
92,what the primperan,22
93,what medicin do you recommend for nausea,32
94,aspégic infant endometri thicken it,28
95,i would like to make a veget charcoal treatment but it seem that the chabon absorb all medicam it so anul the same effect for the pill i wonder if thi is true,34
96,fifteen minut after my price granul copper glucon and drop of colloid sillic i have palpit and feel wrong to me what,28
97,i bleed with my melodia pill that i take for 1 year i am onli mileu my plate is thi normal,28
98,can we prescrib zoeli as contracept,31
99,is what we can take skenan and dolipran same time,34
100,c is possibl avoir breast swell with milena,28
101,doe varnolin caus dizzi,28
102,what is the optim dose dexorat,42
103,stilnox he caus nightmar,28
104,take you how mani mg seroquel,42
105,prozac bromazepam what effect,34
106,can we prescrib dapi boiron stick to the pregnant woman,44
107,i suffer from irrit bowel syndrom and it turn out that the onli thing that realli make me good or anxiolyt unfortun i also have hepat c and therefor have no right to thi type of medic are there a solut,0
108,haldol parkinan what side effect,28
109,bleed under mélian,28
110,tricelest overdos what danger,48
111,i use elavil the naxproxen in small dose for back problem with celebrex wa a lot of spasm in the upper back between the rib back problem degener into anxieti problem and i am now rivotril the even and lie and lie to desyrel also it still ach cours it pass easili lift i think it the drug but im not sure what to do,11
112,quinolon and sun,33
113,i take the pill for 1 year ludéal gen at 930 am thi morn but i forgot to take my pill and i just take it in dc disast 21h41 are t there ani risk,13
114,i take varnolin or at least it qi is call gener desogestrel ethinilestradiol a pharmaci gener as it gave me dab same composit all but the box doe not have the same design and the manufactur is not the same should i worri,6
115,do you know an equival post oper dress opsit,0
116,is it best taken in the morn or the even,38
117,wa it right to let migralgin prontalgin behind the counter on shelv promin patient,8
118,i take dian 35 3 month ago i depress over noth is there a relationship,28
119,polygynax in patient under aldara,44
120,celebrex is in what dosag,25
121,sore muscl and bone after take solupr is thi normal,28
122,magnesia pho veri sorrow rule,31
123,in which case ginseng is it use,31
124,trinordiol pregnanc,44
125,i take melodi for 2 year and then i what look to rule come in midcycl am i still protect against a possibl pregnanc,48
126,pill dian 35 she walk in the first plate and not after 4 month or more,23
127,what altern to ciali,0
128,seroxat,22
129,androcur oblivion advic,13
130,i take the pill triafémi when you forget a tablet with a threephas is that it happen like with a monophas i mean even with differ dosag can we bind platelet in case of last week of forget and if it connect it is onli the last color tablet or entir wafer,14
131,cur rabi vaccin still in danger,48
132,tanganil megamag side effect,28
133,counti take cerazett first time,14
134,what make up the dolipran,5
135,what is the stablon,31
136,rhophylac who know,22
137,what are the sign of overdos mysolin,1
138,rotarix and side effect,28
139,is that the vaccin against mening ha can trigger autoimmun inflammatori diseas,37
140,hello i take dian for 3 year and it is great for moimai i would like to stop and take that is a contraceptionquel are other pill that are not harm to littl but howev are onli contracept thank a lot,0
141,up and down with norset is thi normal,28
142,what is the valid of the vaccin against yellow fever,26
143,euphytos drug or placebo,22
144,dtp vaccin final avail,24
145,i have no rule is it becaus of the melodi pill that i took from 6 month,28
146,no question on drug,22
147,a what is the chamomilla vulgari,31
148,duphaston and pregnanc,44
149,phosphoru and 9ch gelsemium 9ch ca is a what,31
150,do jasminel it is the same pill that yasminel,5
151,climara patch how to use it,15
152,a pharmacist call becaus she would like to know whi there are two dci avail ibuprofen ibuprofen 400mg teva teva health and ibuprofen 400mg and whi there is a price differ between the two,50
153,what is the therapeut class of seropram,4
154,what is the halflif of adalimumab,26
155,hello hello here i recent start use the pill 21 day 7 day off pleas aurrai i love to know what to do when there menarch for the seven day of stop débuté the second plate or the 29th wait day to make it there i am complet lost becaus i thought my period would come after 7 day thank you,14
156,with lisanxia are not t it too withdraw problem,21
157,id like to ask if the tercian abilifi sulfarlem seroplex and give a sore arm,28
158,can we give omeprazol a cat on steroid,34
159,1 month microv and secondari effect,28
160,i take everi morn 3 mg of valium what are the side effect,28
161,what is the surgeston,22
162,clomid is it riski in case of fibroid,43
163,what is the vaccin against mening,32
164,is it normal to have vomit and go slowli ixel,28
165,guronsan who know,22
166,what the gallicum ac,22
167,i am under effexor 375 thi weekend i drank a lot 5 or 6 glass of whiskey at the end of the 5th or 6th i start to feel veri bad do you think thi is effexor who did thi,33
168,triafemi info,22
169,im pregnant oflocet 200 is it recommend,44
170,a solut against nighttim awaken,32
171,ludéal 3h and 12h margin,14
172,hello im in actuellemnt seroplex 5mg i ateint a fairli sever agoraphobia and panic disord with depersonalisationj am my treatment for over a month and no improv still panick about my stay strictli domicileet when i had my home is best not panic fear of be alon fear of fall night etc i saw a enfermon generalist say to me augument the seroplex 10mg but it scare me that do you think,42
173,doe take harpagophytum capsul can caus a signific increas in patient diabet and if so whi,28
174,can anyon suggest irbesartan dure pregnanc,44
175,pdt how long the effect secondairesà stop seroxat,27
176,cycléan and fungu,28
177,how long doe the effect of xenic,26
178,what tricilest,22
179,compar relpax imigran,1
180,after 1 and a half month seropram citalopram it gener no effect on me my psychiatrist prescrib me yesterday seroplex qqun he can testifi about hi action,37
181,do antibiot caus gastric lift,28
182,silica complex can i take dure pregnanc,44
183,are there a gener version of cycléan 30,45
184,what is the vaccin against cervic cancer,32
185,i have to take solupr cortison for a cyst in the wrist but the doctor ha said no salt and no sugar as possibl whi that,43
186,the sertralin she play on libido,28
187,i have to have surgeri the chest is it better to take opium 30ch the day befor or the anesthesia awaken,38
188,doe the pill desobel ge20 give migrain,28
189,question about abilifi,22
190,regard the issuanc of tranxèn 10 if the dosag is 2 per day than we do,8
191,levonorgestrel taken befor ovul how far it can protect,26
192,trimgel and depakot,34
193,i take mianserin atarax night for insomnia and i feel the opposit effect is thi normal,28
194,norlevo effect on pregnanc,28
195,do i risk get pregnant pug with 20,48
196,spotof you know,22
197,which vaccin do now that dtp is no longer avail,0
198,clay alo veroa for use on privat part,14
199,jasmin gener,45
200,brown essenc of indeoù find,24
201,xanax involv,28
202,clarithromycin ampicillin,0
203,it is the differ between hormon dosag and mélian mirena or implanon,5
204,is what my dose seropram is not too low,42
205,i often have requir nebcin célesten gentamicin solumedrol all in inject form and prescrib nebul togeth all are aerosol rout offlabel and thi ha not been test by the laboratori that do,8
206,what if i forget one even daili gen,13
207,xeroquel against anxieti low dose 25 mg what are the side effect,28
208,i wa prescrib microv is that thi pill is effect from the first dose what doe it matter if i start the plate while i do not have my rule again,39
209,seroxat awaken at night,28
210,risperidon in the hyperact adult,43
211,is what we can substitut dexeryl of prescript and toplexil reimburs by the gener,50
212,hello im under seropram and atarax sinc 5 month i feel better about my panic attack and anxieti parcontr but i have troubl sleep and abov all i laughter crise all over the street at home i feel i becom stupid i laugh even for anyth alon in front of the screen of my pc c ad,28
213,risperd is perfect against phobia what do you think,31
214,where do you put the patch evra to be on it doe not take off,15
215,a question about miness or a meter mini pill is it possibl that my period did not come without me so far pregnant,28
216,i took the orgametil and now i take surgeston the chang in the first month i forgot to take a pill and i have taken after 12am then i wa bleed for 10 day but veri light and i found my weird rule i did a pregnanc test wa neg is there ani chanc that im pregnant,48
217,xolair amm in franc,29
218,can the colpotrophin prevent implant of the egg in the endometrium,28
219,seropram with anoth antidepress,34
220,haldol t have ani side effect,28
221,baclofen is anxyolit it,4
222,what altern to meningitec in case of failur,0
223,i have veri a headach so i took a upfen of habit i onli take the dolipran and after have taken i realiz that the date of 022006 laps is i m worri some think it doe not matter,19
224,what herbal tea to lose weight,32
225,xeplion high risk of parkinson,28
226,a patient ask me alkylglycerolsulfon contain in shark liver oil to regul cholesterol not want to take statin is what realli ha thi properti,31
227,enceintr and vogalib,44
228,is it good to take corticosteroid when you get vaccin,34
229,do gener ciali ha the same composit as the origin ciali,5
230,to those who use trinordiol side effect,28
231,uncompl cystiti firstlin treatment,32
232,copper iud and acn,28
233,puffi face is what it is becaus of the valium,28
234,should we take amoxicillin dure meal to limit the advers effect,38
235,i use evra patch and it worri me a littl sometim i super nausea and stomach ach and i realli wonder if im pregnant,28
236,antidiabet how they lower blood glucos level,37
237,i took miness for the first time but after 15 day i still have my period it mean that thi pill doe not suit me or do i have to wait 1 month or 2 befor you know,11
238,dian 35 and it gener,45
239,androcur and no rule,28
240,can a profound fatigu be the caus of clamoxyl,28
241,ill take the pill miness and i wonder if miness stop the rule or we have by have a less heavi flow it is still effect the 1st day of the rule,37
242,i take varnolin and i had an oversight could you help me if you have been in such a situat,13
243,i have to take the 3x day amoxicillin i start the treatment yesterday at 23h23h30 but that night i forgot to wake me up and so i took at 10am is it seriou,12
244,ephedrin refund,47
245,are you it ha a risk of pregnanc dure the stop 35 of dian,48
246,what is lyrica,22
247,a humatrop treatment for a girl of 21 month can you tell me in the long run if there are health risk,48
248,should i avoid certain food with kardef i fear that the effici vari,33
249,what is the nongener version of escitalopram,20
250,peopl who have had to take norfloxacin have had side effect apart photosensit,28
251,the l122 doe it help to burn to lose weight,31
252,what is the drug speciafoldin,31
253,is what we must stop seroxat if we want a babi,44
254,subutex depend o after how mani day,28
255,i had some acn problem and want to know if make me put an implant i might see these aw réapparaitr button,28
256,what kind of drug is seroplex,4
257,i am under cerazett sinc qq month mnt for 1 week or i bcp more abund white discharg than usual i have to worri about me,28
258,which vaccin against cervic cancer of the uteru,32
259,there is a gener drug inexium 20 mg,45
260,i take melodi but last month i had bleed dure the 2nd week of my plate thi month it start over again and the bleed is realli like a littl earli and most import rule it what is in your opinion,28
261,ciali avail in quebec,24
262,can i use herbal medicin in the treatment of insomnia,31
263,when to neisvac vaccin in infant,44
264,what are the side effect of prozac and effexor,28
265,abilifi 5 mg you know,22
266,my doctor prescrib me xanax of 050 and stilnox howev i feel that the stilnox gener start to not make me effect you need it i ask him instead of imovan and what are the side effect,39
267,gemzar cisplatin,34
268,propranolol against anxieti or not,31
269,is there some who have alreadi manag to reduc the dose of norset and sleep normal,42
270,what homeopath treatment against cramp,32
271,methadon to replac contram,0
272,prevenar for ani indic c438,31
273,what s is are s risk s meet s if i give birth befor the inject of rhophylac,48
274,i suffer from solar urticaria a doctor ha recommend 100 mg calcium the problem is that i do not know if i can find it in franc is can someon tell me if there is a drug even gener of thi type and if ever you need a prescript,29
275,after pill and cerazett,34
276,gynecolog me do an inject of gonadotropin and sinc yesterday i have pain in the belli is that peopl can clear up a littl,28
277,what neisvac c,22
278,i have a synovi effus spontan appear i went to a homeopath who prescrib tablet ribe nigrum folia but it too expens i discov that bryonia is indic in effus and api mellifera i thought take bryonia 5 chest thi correct,42
279,the lyrica anyon know,22
280,i wish to have opinion on the effect of the implant,28
281,are there ani interact between maxalt and propranolol,34
282,trinordiol without prescript,8
283,what are the possibl vaccin dure earli pregnanc,44
284,alcohol antibiot,33
285,i have eczema after take extranaz what should i do,11
286,which is under lodoz,31
287,my gynecologist ask me to do the boostrix vaccin diphtheria tetanu cocqueluch but im 27 week pregnant i therefor ask myself if it is danger for my unborn babi,44
288,iud in cuiv avail at famili plan,24
289,do bisoprolol crister bisoprolol hemifumar may well substitut the cardensiel bisoprolol fumar,50
290,effect of egg lomexin 600,31
291,copper granion they are reserv for adult,44
292,advil he caus cramp normal,28
293,is there a risk for the babi born to take omeprazol,44
294,i have a box of paracetamol which expir in 2006 is reason to the consumpt or is it danger,19
295,midwiv have the right to prescrib a pill but under what condit,9
296,carrenc iron what treatment,32
297,if a bad reaction or complic follow a vaccin against hepat b how long after inject it doe ariv at least from when can we say that there is no bad reaction or complic,27
298,i made a mistak use nuvar after put my 2nd ring i remov one week too earli and without see my mistak i put anoth right away meanwhil i had intercours at risk is that there is a risk of pregnanc is that thi risk is spread becaus anoth ring wa insert just after,48
299,seroplex wean difficult,21
300,what is the limit number of deliver compress stock in 1 year,8
301,fenofibr he caus weight gain,28
302,pregnanc magnesium author,44
303,the usual vaccin schedul is 2 3 4 month do you know what is the toler rang between dose,42
304,desol to shit my world call me are what cerazett littl to have a cutan rash on the bodi after 4 month of take j saw the dermatologist he said alergi a laundri or a shower gel or soap or anoth but it do a month sinc it last cream do noth ca scratch on the belli bodi under the breast arm between the thigh as roseola ca ca do and scratch you have an idea you becaus the d in thi funni littl thank you and all thi desol,28
305,i take the pill minidril for a month and sinc almost the first day of take my moral is not great i cri veri often and ha other moment i am veri happi is that my symptom may be due to the pill,28
306,help ixprim addict,11
307,a prepar pharmaci ask what is the amount of lactos in the letrozol eg,5
308,iron defici what,32
309,veratran and apnea someil,28
310,what quorgastoro,22
311,i just read the manual which say that i have to take yaz after my holygièm pill while the gynecologist told me to take the first day of my period so when do i take,10
312,exomuc déremboursé,47
313,my doctor prescrib me depakot but it seem that thi drug can make you fat those who take it is what you have grown,28
314,sinc i took the pill jasminel a few month ago i had small spot of blood or brown without graviti today i bleed as the earli light enough rule i do not know what i must do,11
315,what he ha in the priorix vaccin,5
316,is what the tranxen increas appetit and give vie to eat,28
317,bcg vaccin my son 1 month,44
318,i take bromazepam how long doe the effect rebound describ in the record,27
319,ludéal doxi ge 100 gen rubozinc mix,34
320,i take minidril and i forget a due compress and i have taken pa i want to know if i aret on tuesday as usual or if i take everi tablet,13
321,suffer from erect difficulti ha someon you alreadi use a homeopath remedi if so with what result,31
322,effexor and age,44
323,pregnant under treatment garden 50mg is thi a problem,44
324,stresam valium,34
325,risk of longterm minoli,48
326,how colecalciferol,37
327,lercanidipin may be suggest dure pregnanc,44
328,trinordiol made it grow,28
329,i went in copper iud i now have red patch button on both cheek what to do,11
330,how long side effect of the vaccin ror,27
331,can we take dolipran nurofen and at the same time,34
