ID,question,intention
1793,clomid and fibroid,43
1794,what to replac the valium,0
1795,from when the pill triella doe effect,23
1796,i wonder how the maxilas includ the activ ingredi is alphaamylas and two other drug that share thi pricip activ can have an effect on sore throat,37
1797,homeopathi is it support by the secu,47
1798,i start my first plate of adep thi month and theoret i should take a break of 7 day as i do not wish to have my period next week i wonder if it is not better to chain the 2nd wafer,14
1799,duphaston what is it,22
1800,is what i can use my ratiopharm seawat outdat sinc 032013,19
1801,my girlfriend take for the veri first time the mercilon pill if such rule fall on a monday 7 take the pill on 14,14
1802,a pharmacist ask whether duoresp spiromax is the gener symbicort turbuhal,45
1803,i am look for a refer to an elast bandag finger,29
1804,it must dilut magnesium chlorid,36
1805,i would like to get pregnant my doctor prescrib me anti lariam as treatment pallu but read the indic con i could take over the process chamber what other treatment do you recommend,0
1806,the lyrica,22
1807,i just re polio vaccin dt think that my last vaccin wa in 94 but i appercu that im the vaccin in 2001 so there is a 5 year interv while c everi 10 year for adult is it seriou,48
1808,is a combin of lithium may increas the effect of an maoi anxyolis,34
1809,pill melodi give bizzar rule,28
1810,how mani gram of paracetamol pusi i take per day,42
1811,we had a ritalin prescript for an adult but it wa specifi off nonrefund amm after the order is made for hyperact follow thi treatment for a long time if it is not written off nonrefund market author is to be reimburs,47
1812,the mother tinctur is taken with hot or cold water,36
1813,seroxat side effect,28
1814,helicidin maxilas rhinotrophyl allow,34
1815,seroxat and what do you know,22
1816,i wonder if we lose weight after the stop of seropram took 68 kilo becaus i feel that it will be wors for me doe what,21
1817,tetanu vaccin and measl i can do both at the same time,34
1818,after how long doe amoxicillin effect,23
1819,arnica treat fibromyalgia,31
1820,decontractyl 500mg what is it,22
1821,tenormin pregnanc possibl,44
1822,i take norset for 6 month and i suffer from muscl pain myalgia is therea peopl who have had thi problem,28
1823,triflucan allergi swell of lip and mouth nose,28
1824,do we have a suffici declin in the use of aubagio in franc sinc when is it avail,18
1825,inform on cerazett,22
1826,where can we buy silica g5 iraland or in spain,29
1827,i take prozac for 4 day 1demi tablet a day it might make me lose weight more,28
1828,i take seropram sinc 3 day i felt all weird is thi normal,28
1829,what are moistur that can advis a patient with nasal irrit from glass of oxygen,32
1830,i made my last tetanu booster there about 10 year i wonder if i realli have to wait anoth 10 year to make a new remind from what my doctor told me or do i have to do thi year,42
1831,seroplex alcohol,33
1832,t are there b5 vitamin capsul,30
1833,my gynecologist prescrib me melodi replac jasmin should i start take 7d after the last tablet of jasmin as indic by the gynecologist or the day after the last tablet of the latter as regist with the melodia user guid,14
1834,xanax and pregnanc,44
1835,i am under jasmin i had a forgotten pill on the 4th day i resum the next day and anoth forget the 8th day caught up again the next day onli i had unprotect intercours on day 12 4 day after the resumpt of the pill is what i have to keep my pill as if noth had happen and have sex without a condom after the 7 day after the resumpt of the pill or should i wait until the bleed caus by my pill norlevo and resum from the begin as i read in a site,13
1836,what do you think of equanil in treat problem of coordin,31
1837,how long doe xanax for effect,23
1838,how long for the seroxat effect,23
1839,hello thi is sinc septemb 2013 i wa diagnos tag and i start treatment in seroplex 5 today i am much better but sometim i sleep veri badli with nervous and spasm dure the night is it normal then is what the seroplex is danger for your health if taken over a long period thank you,28
1840,i take the pill trinordiol i forget to take my first stamp my plate is that i have not secur relationship with my boyfriend and that the next time i can get my first pill on monday as befor or hell have to take a continu tuesday,13
1841,should we get a care agreement with a more than 60 year old patient befor issu the depakin,8
1842,sore leg is it becaus effexor,28
1843,how much doe the gardasil,46
1844,adep pill i do not understand how it is,37
1845,temesta tranxen,34
1846,i made a urin test and there is infect so my doctor gave me the monuril 24 hour after i realli have intestin disord as written on the note nausea and diarrhé if qqu had also cer fact that youv taken i drank coke but it not the top,11
1847,what inconveni with avastin,28
1848,what is vicodin,22
1849,hello here i am as nuvar birth control for about 1 year and today i had to give it thi morn and i have complet forgotten the blow should i do thank you,13
1850,hi girl i saw my gyno friday to tell him we want a babi she told me to finish my plate my plate microv that end last night we are too press can you tell me about how tp in gener to have a littl piec i prennasi microv so it a pill microdosé so it will be faster or not thank you to enlighten me as soon as possibl we need to know to make everi effort to have it as soon as possibl it too big a shortag at home i can not even keep me from spend long moment in the radiu for new born and i alreadi want to buy thing,26
1851,i come to thi forum to ask what you think of my treatment prescrib by a psychiatrist norset 3 2 1 laroxyl tercian 25mg 50mg 3 lixanxia no sleep pill becaus with norset and laroxyl that make sleep even if sometim sleep is come along in thi case i add a tercian i have not taken too much weight for my normal i observ thi treatment for three year but i follow for depress symptom of anxieti disord for 14 year i do not get out of thi spiral on that came to greffet seriou famili problem i am also a treatment for the stomach with 1 pariet 20mg and treatment against constip and spagulax transpeg and to top it off as im bronchiti i often take antibiot sincer is that all that is compat with a profession activ becaus im realli tire i still black and a bad imag of me i tri everyth psychotherapi and psychoanalysi it did not work the onli thing that better i have more morbid idea at least i have more intent to end but life remain stubbornli gray,33
1852,i start my plaquet of trinordiol by the end and thi for 9 day what to do stop and take anoth plate and start at the begin,12
1853,what are the amount need to influenzinum yersin serum and bryonia,42
1854,i wa seropram 1 day for lunch and morn i see weird dream disagre is thi relat,28
1855,visual disturb with gabapentin,28
1856,whi should i take duphaston,31
1857,iec combin can sartan,34
1858,hepat b vaccin without aluminum ca exist,5
1859,arnica at what dose and how to babyfrequ,42
1860,is that the vaccin against mening can trigger autoimmun inflammatori diseas,28
1861,1 month microv and symptom of pregnanc or secondari effect,28
1862,what dosag for arnica 9ch,42
1863,im 27 and ive had an inject of ror vaccin at the age of 12 i know there must be a second inject off i have ever done estel advis thi second inject,42
1864,alcohol and seroxat,33
1865,the sertralin it may be the caus of my back problem,28
1866,pyostacin give mycosi,28
1867,is what crataegu oxyacantha also affect anxieti,31
1868,sed pc what is the durat of treatment,42
1869,who is procalmil,31
1870,with current triella is what someon would experi it in the field and advis me an equival pill,0
1871,i have been 6 month under androcur 50mg 12 tablet daili and estreva 1 tablet daili taken 20 day stop 8 day and i have them with my partner a relationship without a condom there 2 week is that im fine with a contracept treatment,31
1872,can you use the charcoal with chemotherapi,34
1873,triafémi how,14
1874,dostinex he ha an effect on the voltag,31
1875,is what we can take evotirox dure pregnanc,44
1876,what may take ixprim with alcohol and drug,33
1877,can i take the ibiprofen and ponstil,34
1878,becaus of the allergi patient i tri antihypertens without titanium dioxid but without magnesium can you suggest,5
1879,side effect harpagophytum,28
1880,i want to take 36 tablet of loxapac 50mg 51 tablet of zyprexa 10mg and 75mg effexor 40 what i risk,48
1881,my littl piec had it ror vaccin two day ha veri high fever sometim 395 do you know how long do these reaction to vaccin ror,28
1882,what dosag form anti fungal treatment is better toler by the mucou membran,1
1883,what is a neurolept,4
1884,how to use the tinctur juglan regia,14
1885,t is there a differ between prozac and disolubl gellul at what time the small dej take prozac,39
1886,take dépamid caus a problem with your sexual,28
1887,when to stop seroxat,14
1888,it may take sectral 400mg per day for a babi test,44
1889,actif and erectil dysfunct,28
1890,magnesium how,30
1891,i wish i knew if differin ointment against pimpl wa danger for the babi test,44
1892,i take progesteron sinc the last cycl and thi month my red were shorter and less abund and yesterday i wa j11 g of new blood loss dsl for detail is that it go decal my ovul,28
1893,eczema around the eye and pregnanc solut,32
1894,whitlow child which antibiot,32
1895,exiist t there a gener drug propecia,45
1896,i am under erod i have pain in the lower abdomen fatigu is possibl with mirena,28
1897,what is the halflif of lysanxia,42
1898,hello g a friend who take melodi and forgot to take her pill her boyfriend and she no longer use condom ha it a risk of becom pregnant that should she do thank you for your answer,13
1899,you have big libido problem take seropram,28
1900,provam androcur to block the rule,31
1901,onset of action dafalgan,23
1902,seroxat effect on anxieti,31
1903,what treatment for nasopharyng,32
1904,hello i take the gener pill of minerva and within a week i stop as usual for my period i would just not have the week am becaus i will spend the week with my boyfriend is it possibl that at the end of my plate i took anoth in success without normal stop a week then resum is it danger thank you in advanc,14
1905,can carbosymag be use to deflat the belli of pregnant women,31
1906,gentlemen who are under treatment humira your wife girlfriend she wa herself pregnant while take thi same treatment how it happen,43
1907,lycopodium good for babi,44
1908,can we deliv atrov aerosol if it is prescrib by a gener practition,8
1909,i take the pill for more than a year last week wa my week shutdown i had to take my pill earli in the week but i have forgotten my plate i have therefor repeat tonight i want to know from how long it will redo effect,27
1910,when is that copaxon 40mg will be avail in franc i saw that he wa alreadi market in belgium,18
1911,norlevo how mani tablet daili,42
1912,i take cerazett sinc friday but i have dark brown loss or even red at time whi bleed now after 8 month without anyth,28
1913,extrasystol it is a sign of seroxat withdraw,21
1914,do i drink a glass of wine while i take 10mg of citalopram,33
1915,a copper iud ut380 short i wa rais in the midcycl also signific pain dure instal i had heavi bleed and after about two hour from the lay the pain doe not go away and bleed although quintermitt either can anyon tell me how long thi can last,27
1916,that take in case of cold dure pregnanc,44
1917,what is the risk follow a slight overdos of paracetamol,48
1918,jasminel what are the most common side effect,28
1919,magnesia pho veri sorrow rule,31
1920,surgeston,22
1921,my son wa everi winter under tt flu prevent homeo thymulin 9ch influenzinum 9ch serum yersin 9ch i like to know if anyon can help me how to give granul,42
1922,whether taken in case of migrain and therapeut failur with triptan,0
1923,i have to make vaccin against the hépathit ha havrix and one against typhoid typhum v1 did you practic worri,28
1924,i take continu varnolin 7 green pill at the end of the wafer doit automat bring the rule or after a time it wa more our rule,37
1925,my husband is under piquûr nalbuphin you risk it becom depend,48
1926,what are folliculinum and ha luteinum exactli,31
1927,lumalia effici in how long,23
1928,is what my loss are white becaus of the pill,28
1929,can i drive under temesta,43
1930,i take triafémi i deceiv tablet sinc with my boyfriend we take our precaut but it is necessari to continu sinc i began anoth plate,12
1931,elevit who know,22
1932,hello what are your experi and testimoni on temesta,22
1933,do the seropram decreas libido is that it happen most of the time,28
1934,trinordiol effect from day,23
1935,i want to know if a pregnant woman ha alreadi taken the antibiot amoxicillin,44
1936,the bilaska he work sever day,26
1937,clozaril what dosag are avail in pharmaci,25
1938,side effect of zoloft,28
1939,inde with lutenyl that should i do,11
1940,when a utlis compe on a close bulb must it be disinfect or is it suffici that the skin is clean,14
1941,i just learn qe im pregnant i probabl have vaccin remind to do pr abl to do my internship in hospit porrai is what i do be pregnant or is thi danger bb pr,44
1942,i read the direct against amoxicillin is that thi onli happen in complet and extrem rare case and thi is veri common,28
1943,im 6 month late for my recal dt polio i tri to have a babi if i make my vaccin id have to be care for a few month for a babi or i could continu my test quietli without ask question,44
1944,i voi on the board of minidril there the day of ecri abov if my first day rule is wednesday what i just take ani wednesday on the plate,14
1945,i usual take my pill jasminel to 22h in the even but then i took it around 4 matinj would savir if there is a risk in delay,48
1946,renutryl what volum,6
1947,the lasilix is ​​it danger,48
1948,folic acid side effect,28
1949,with current effexor 150 mg for almost one year and ill probabl stop and go under seroplex is the withdraw pain,21
1950,hello my doctor chang my antidepress effexor for treatment of seroplex my question is which side effect you have had with take thi medic with efexor i had side effect like pasti mouth and constip with seroplex you are there for some s of you had weight gain thank you for your repli,28
1951,i wonder if lon can take ibuprofen with solupr,34
1952,the pill doe she inde i take 1 week now is cycléan i think,23
1953,nootropyl is it good for children,44
1954,i have a patient who ha been success under humira and enbrel for spondyl which ddéveloppé thymu cancer and ha hot flash what do you recommend,32
1955,consequ of the withdraw seroplex,21
1956,with dian 35 after how long stop the condom,26
1957,how did you do when you have an allergi to aus of an iud,11
1958,xanax mixtur abilifi,34
1959,essenti oil dure pregnanc,44
1960,vibramycin elll is indic to prevent malaria,31
1961,i take the pill ludéal gen but i have a treatment for angina base amoxicillin is it that thi drug can affect my birth control,34
1962,is that ppi action on receptor in the gut,37
1963,i stop seroplex now i have the monstrou fatigu someon can help me,11
1964,seroxat side effect and other issu,28
1965,champix still avail,24
1966,sinc i take zoloft i have nausea and dizzi wake up what to do,11
1967,a nurs can prescrib the urgo k2,9
1968,how to use essenti oil,14
1969,theralen and drive vehicl,33
1970,what that norset and dépamid,22
1971,zovirax and pregnanc,44
1972,quetiapin to 67,44
1973,if on a secur prescript the doctor prescrib specialti list 1 and 2 and zolpidem in the squar must put 1 for narcot specialti or the total amount of prescrib product,8
1974,mianserin it can caus atrial fibril,28
1975,doe the use of cortancyl dure pain crise becaus rheumatoid arthriti is consid offlabel use,31
1976,you know other treatment that reliev pain of teeth,32
1977,my daughter had the two inject of the vaccin infanrix quinta and i do not want to paa recal what are the risk to stop be vaccin,48
1978,is it true that xanax pourait reduc the urg to smoke,31
1979,zoloft make you fat,28
1980,one of my prescrib seroxat you know if it will affect the appetit and or weight gain,28
1981,i take cerazett for almost a year and occasion i have brown loss it last more than 8 day it normal,28
1982,naramig comparison and imigran,1
1983,i read that the haldol creat bore and impati but i take 5 mg daili i do not know what to do,11
1984,alprazolam treat anxieti but treat he also irrit,31
1985,helicobactèr pillori and pregnanc,44
1986,cefixim gastro,31
1987,bjr everybodi we just prescrib me dépamid at 2 night dose at 300 mg pdt 10 day somebodi he ha alreadi taken if so is it effect and what are the side effect thank you nadin,22
1988,can i dilut one tablet of ibuprofen in a glass of water to swallow more easili,14
1989,i went to my doctor to my second vaccin against hepat a and b the second vaccin give me a lot throughout my left arm and my left hand is thi normal,28
1990,hpv vaccin what to do,22
1991,my dog ​​i veri stress and anxiou in natur more it made seizur we start treatment with phenobarbit and i would pair it with homeopathi epileptyl but for the anxieti and stress do you think i can give him gelsemium,31
1992,st john wort or buy,24
1993,the laroxyl what is it,22
1994,what do you think of a prescript for a pregnant woman 7 month ferrostran 2bdr 3 daili folic acid 04 mg 2 day,44
1995,is there a homeopath vaccin against tetanu,32
1996,my girlfriend and take seropram na more hate to me that normal,28
1997,can we deliv castor oil in quantiti greater than 30 ml,8
1998,valium he give nightmar,28
1999,my refriger broke down all night with copaxon in and the maximum temperatur wa 15 ° c can i still use it,17
2000,lysopain and coluhextril,34
2001,it been a week sinc i take cerazett and yesterday i wa bleed like my rule is thi normal,28
2002,what the estrofem,22
2003,a woman take levocetirizin 5mg arrow laboratori becaus of one tablet daili would like to know if it can take 2 tablet in time of allerg attack,42
2004,the drug metformin 100 mg against diabet make it realli lose weight,28
2005,stablon atd,4
2006,my son wa vaccin yesterday is red and swollen maintenantqu should i do,11
2007,mirena acn but is that it will fade with time,27
2008,my daughter 10 month and never did hi night she enerv grow and ha difficulti return to sleep i tri sinc yesterday stramonium 15ch and mayb ill add arsenicum 15 hp but im not sure if it wellsuit to hi age,44
2009,what are the advantag of veratran,1
2010,i just had a dental procedur and hast command me to amoxicillin 1g sandoz dispers tablet i wonder if there is an indic against use cannabi with thi treatment,33
2011,dian 35 stop acn,21
2012,how lyophil tablet in spasfon box,6
2013,divariu withdraw,28
2014,i have a patient who want to treat hi psoriasi of the scalp with essenti oil that you recommend,32
2015,adep sequenc of portfolio and recoveri,14
2016,inexium for ulcer,31
2017,or purchas of white dead nettl arkogellul,29
2018,my girlfriend wa take the pill minidril for 1 year but the doctor chang her pill for dali géest it normal not see plusa libido,28
2019,nuvar it laps,19
2020,what is the first use of prednison,31
2021,i have to take seroxat the morn afternoon or even,38
2022,my doctor just prescrib me surgeston to treat endometriosi how long doe it take,42
2023,how to put betadin on crack at the entranc of the vagina,14
2024,i went contram buy without prescript from my doctor and pharmacist gave me 50mg contram without ask me anyth thi is normal or prescript should have been ask,8
2025,the dolipran it can derail,28
2026,i took two tablet of 40mg panthoprazol inadvert is that bad,48
2027,lutenil tell me about thi medic,22
2028,abilifi new treatment,0
2029,is there a risk of pregnanc with iud copper,48
2030,what is the indic of a singl dose of azithromycin to 3g,31
2031,sinc ten day i take dolipran 100 mg per day make a total of 15 mg of 00 in 15 day dolipran is it an overdos,42
2032,is it possibl to get pregnant in nuvar,48
2033,what are the differ iud,4
2034,itch questran,28
2035,miness and migrain,28
2036,how doe effexor in the molecul,37
2037,if i take more valium bar i might what,48
2038,is it possibl as a classic pill take 10 continu luteran if luteran forget what is the time to use a pc without have to protect themselv becaus otherwis risk,39
2039,hello who ha alreadi taken the pill and it gener mélian have you had problem with chang normal thi should be the same thing but for me i had some clear chestnut loss spot to chang i await your answer thank you,28
2040,i can not stand the miness pill and my gyno gave me melian instead my gygi told me to stop miness dc on thursday even to take the last and take melian tuesday that is as usual with miness and then pendt 3 week and 1 week of rest is what it is ca account is what i am protect by chang pill and im protect dure the period of rest and 4 day of rest between miness and melian which ha alreadi taken melian and qd vsve had your rule,39
2041,it did 12 month i wa take more pill then im lay of 7 day but i do not have my period is thi normal,28
2042,a patient treat with 10mg seroplex ask whether she can take tylenol with treatment,34
2043,revaxi,22
2044,seropam can be taken with anoth antidepress,34
2045,can the granul homépathiqu be dilut in a solut,36
2046,pill jasmin who know,22
2047,what are the side effect of stablon,28
2048,i start my pill upsid for 2 day what must i do now,12
2049,xyzal and palpit,28
2050,is what is spasmin somnifer,4
2051,i just start holgyèm there 3 day the hour after take the tablet i feel sick nausea and headach do these symptom persist over time,27
2052,ace inhibitor and arb can they caus function kidney failur,28
2053,what are the risk of monuril urispa and if im pregnant,48
2054,what risk to take macrogol sever month now,48
2055,luteran to take continu or not,42
2056,viscou xylo and eludril in children 3 year to mouth hand foot syndrom what do you think,44
2057,i forgot my pad melian and pharmacist gave me the gener to complet my cycl is there a risk know that it is the same molecul,48
2058,i made a judgment of 7 day between jasmin and trinordiol is thi seriou you for stop 7 day between the last and first trinordiol jasmin,10
2059,have you ever had a prescript for josir in an elderli woman in ditropan,31
2060,is what arcalion can caus insomnia,28
2061,i am under treatment chemotherapi sinc novemb 2007 it is use even cautiou or downright danger to let me inject the flu vaccin,34
2062,how to prepar a solut of arnica,36
2063,i speak of temesta expidet which melt in the mouth 1mg how long after take the medic he start to work,23
2064,phenytoin,22
2065,my doctor prescrib duphaston thi will enabl me to quickli you fell pregnant,23
2066,is it danger to take valium pill whose expiri date ha pass there 6month,19
2067,i take varnolin continu varnolin is my first birth and the jusk i never had regular cycl so i have some fear to approach the end of the first wafer i have to start my second plate as provid with thi type of varnolin although i have not had my period the end of the first wafer ye the contrari i have to wait for the arriv of my rule befor you start the follow i think the effect would cut ca nan,14
2068,is that like me the pill cerazett caus you high migrain,28
2069,revaxi pregnant and tubertest,44
2070,child amoxicillin dosag,42
2071,brewer yeast may it be use to restor the intestin flora when it is subject to constip,31
2072,what the arpagophyton,22
2073,spot dure ring but no rule dure break,28
2074,i take trinordiol for 8 day and im just cri and depress spot wors and wors everi day what to do,11
2075,i think folliculinum start how much doe it cost,46
2076,i have my golden rule is that hi 2 week i chain the 2nd plate i am current do a miscarriag,28
2077,offici inform theralen,22
2078,when first start take the pill after norlevo,10
2079,i seroplex screech halt for two week becaus i want chang what can i take,0
2080,my mom 39 yearsold ha just learn she ha a gener cancer it began with a ulteru the cervic cancer that ha spread to the ovari kidney bladder and stomach doctor perform a hysterectomi but it wa not enough it is a treatment you can,32
2081,i start leeloo ge thi month and a few day i began to have abdomin cramp as in rule and brownish discharg sometim red is thi normal,28
2082,more rule sinc the withdraw of mirena,28
2083,paracetamol doe not éatit an antiinflammatori analges but it would block pain nerv impuls in the brain is what someon would know how it block thi influx,37
2084,i take the pill trinordiol that i should resum saturday but i resum sunday after a 7 day not stop but 8 i wonder whether it wa seriou or not,48
2085,free altern to prescript inexium 40g,0
2086,trimgel depakot and there are compat n,34
2087,minoxidil 5 inadvis for women,44
2088,i forgot my pill daili task gen my parent i still have an old androcur pill can i take to replac ge daili for a few day,0
2089,hello i just remov mirena 1h ago after concern rule for 3 month mirena wa 4 year old and worri sinc i have thi iud the gyno desobel prescrib me dose micro repaid i have to wait my rule i know but can i take the pill mtn what are the risk i did not want to wait becaus i bcp do swim and i like to know ill be set qd advic thank you,14
2090,i forgot to take holgyom should i take 2 consecut pill,13
2091,the sipralexa it is effect against anxieti,32
2092,the pharmacist receiv an unusu order colpotrophin cream for a child under 2 year to heal irrit she ask if such a case ha been identifi,44
2093,clarithromycin dosag in children,42
