ID,question,intention
3897,i take mercilon for some time onli i have not had time to get a prescript and i fell in the cours of pill as i have alreadi taken norlevo is that i also take 2 mercilon ajd pr catch up yesterday or is it better to wait for my next pr rule again,13
3898,can i open a capsul loxen lp 50mg,49
3899,what to replac the vasorb,0
3900,i had a relationship with my boyfriend unprotect i took the evra patch and yesterday i remov as i do not have the patch yesterday is that it will be a risk that i get pregnant,48
3901,quelqun can find out about the ponstyl,22
3902,salbumol ha 39 week what are the effect of thi stuff becaus i have not slept all night hard stomach,28
3903,cérat of galien against use in children under 3 year what is the altern,0
3904,jaydess so patient ms,43
3905,i had an inject of tubertest i wonder if thi test not àna slightli weaken my bodi becaus i am ill is it possibl that thi is due to the test,28
3906,problem with xeroquel,28
3907,what risk after ingest 8 g of paracetamol,48
3908,solian déshinnibiteur abov 200g,42
3909,arnica at what dose and how to babyfrequ,42
3910,st john wort and psychotrop allopatiqu,34
3911,gastrointestin my gastroenterologist put me on librax becaus of coliti i am look to get pregnant my bb3 i told him and me even qd prescrib what should i do do,14
3912,i would like to precis inform about these vaccin infarix and prevnar are they mandatori you can find the same vaccin in singl dose we can do the inject separ as 5 or 6 molécuel of a sudden it huge in addit to prevnar,39
3913,dificlir is it reserv for hospit use direct,39
3914,dian 35 pill or anti acn,22
3915,i wonder if a qq ha alreadi suffer from vagin dryness dure use spermicid pharmatex spong,28
3916,i would like to know the price of clomid,46
3917,i have a effexor treatment solian for 2 me then i move to the anafranil 1 month i decid myself to discontinu treatment and have sinc dizzi and nausea bound,21
3918,xanax pouruqoi,31
3919,littl question about androcur,22
3920,avlocardyl beta blocker against anxieti,32
3921,can i substitut remeron mirtazapin,50
3922,is that you know if the tranxen is somnifer,4
3923,are ha there a risk of nausea or cancer or other with adep,28
3924,rhinadvil and pill,34
3925,arct and trinordiol,44
3926,pregnant and flu vaccin,44
3927,remicad who know,22
3928,i mention three consecut day to take my pill and i took yesterday and today but i do not know what to do tomorrow morn i take my pill and i expect the end and i am take normal,13
3929,minidril and ludéal ge ditto,0
3930,i want to know if we could do the tetra in infanrix primari immun,14
3931,at what time doe it take amino acid,38
3932,i am under pill jasmin and i made an oversight i took the miss pill and i have had two report no other sinc so there i finish my second plate of the rule and not as usual i take my pill monday night without ask question you think,38
3933,anafranil morn or even,38
3934,weight gain is common as it seropam,28
3935,is it normal to have blood loss use mirena,28
3936,can sifrol caus urinari sphincter disord,28
3937,gener of seroxat,45
3938,i made the vacin tetanu and sinc i sparm muscl in the throat es that it happen wa the other person,28
3939,what time is it better to take my bilaska,38
3940,is there a vaccin for tetanu onli without aluminum or other harm addit,29
3941,what are the differ assay infarix avail,25
3942,duphaston absorpt time,41
3943,hello there i took dian for 4 year and then i chang to melodi i know the rule occur dure the white pill but for exampl if they arriv dure the penultim or the last blank charact then i would have the rule dure 1day seen after the last white stamp it make with the other wafer i lost sight with dian there is a paus and that the rule 1semain arriv dure it help me thank you for your answer,37
3944,what is the new ad that can replac seroxat,0
3945,what are the indic of effexor,31
3946,i take microv even and i took it with a 20 minut gap is there a risk of get pregnant,48
3947,nexium prescrib me do the side effect last longer,27
3948,i would like to have a child against zyprex i take 5 mg daili there til risk with thi drug,44
3949,i take effexor lp 75 mg in the morn for sever year 2 caplet day for sever month my gamma gt are regularli around 60 iu l effexor is it the caus,28
3950,pm 500mg amoxicillin compress 2,42
3951,norprolac,22
3952,microv how long to take effect,23
3953,im on prozac and valium is compat with pregnanc,44
3954,seropram question,22
3955,rivotril 25 mg ml a bottl of 10 ml,6
3956,i must make two vaccin monotest and hepat b i wonder if these two vaccin can be done simultan or if an interv to be respect,34
3957,seroxat withdraw 12 1 day 2,42
3958,minerva minipil or not,4
3959,i wish to ask me a copper iud dure my next period i want to know befor so i can feel discomfort dure intercours and if it could move,48
3960,do you have ani inform about st john wort and flower of bach,22
3961,evra patch same dosag,25
3962,how to dian 35 varolin,10
3963,opium 30 ch can it be urilisé to reduc postop pain,31
3964,can we make a vaccin against influenza pregnant,44
3965,i take avlocardyl betablock and everi time i have a big blow bar 1 hour after take it for a coupl of fortun is what it is normal for those who know or what i should shutdown the treatment,28
3966,how much doe qlaira,46
3967,from when the pill triella doe effect,23
3968,hello i wa under noroxin three day last week and then under rocéphin 48 hour in hospit and am now under ofloxacin i wa veri ill the right shoulder sinc noon a friend suggest me to look at the record and i see in children in case of joint pain stop tt put the joint at rest prevent and your doctor will take appropri action im not a child someon just tell me more,28
3969,mélodia chang to the ring is what i do to stop 4day then i put the ring or is it that onc finish tablet of color i put the ring the next day,10
3970,ixel,22
3971,driptan who know,22
3972,paracetamol capsul what other form,30
3973,good even pleas i take minidril 21 tablet and lay smain and the last week of my plate think you forget to take a pill on friday night i took 2 on saturday night but i wa well taken friday night and saw ke i thought realli have been a delay of over 12 hour i knew kil fallai enchain with ur plate without fair lay a week but ive realiz the follow tuesday even 2nd day my week of lay normal ke i navai were no delay and ke suddenli on saturday i took 2 pill and monday and tuesday be the censer be deposit my debu week i took them plillul brief doe take 2 pill a night and to forget didnt do take pill dure instal 2 night in a row in loccur what peuven be the consequ dsl bcp if you have troubl to understand me thank you bcp your help,12
3974,miss tablet miness befor yesterday what to do,13
3975,what are the side effect of stresam,28
3976,norlevo and delay rule pregnant,48
3977,it may take 2 zaldiar of a sudden,42
3978,what can you prescrib a babi under 30 month for canker sore in essenti oil,44
3979,my psychiatrist prescrib me 2 norset night and i wa take prozac 1 in the morn when he gave me two gp are there side effect to,28
3980,hazard ultra yeast and pregnanc,44
3981,9 year sinc i wa in there and there diane35 3month my gygi chang me leelo gen i had to stop the pill and sinc im not well mental is that it can be of a bu stop on the pill or is it me simpli,21
3982,is what is spasmin somnifer,4
3983,can we use aspirin for primari prevent protect,31
3984,i took seropram i stop complet and sinc i am not feel well dizzi nausea feel faint how much longer will i have to endur thi state,21
3985,with current andocur 50mg and provam 1mg and i had unprotect sex i wonder whi the instruct androcur it is precis that one should take thi drug with contracept 1,14
3986,birodogyl may til him onli remov an abscess,31
3987,efflexor morn or even,38
3988,i took endotelon 3 tablet a day for poor venou circul is quil to stop or not endotelon dure pregnanc,44
3989,guronsan issu,22
3990,what advic for the use of the pill daili gen,14
3991,may be taken of the pregnant cocculin,44
3992,reaction infanrix 2 month,28
3993,i forgot my pill im in the last week of wafer je have not had sex last night but tuesday night what should i do i take jasmin,13
3994,seroxat and liquid that come out of the breast,28
3995,i irrit after the report it is a cream to rehydr,32
3996,the product are homéopathiqu counter or onli ordonnac,8
3997,is amoxicillin can chang the smell of urin from my babi,28
3998,pharmaci issu by mistak a box of 150mg of dolipran instead of 1oomg i have given thi treatment my child 6kg know that etai a supossitoir morn noon even is that bad is there a danger to my child,48
3999,is the otezla is an except medicin,9
4000,who is abilifi 5mg,31
4001,what treatment for pain scalp,32
4002,leeloo ge ge is ident to lovavulo,0
4003,you have to sleep effect level and go slowli citalopram,28
4004,champix stop smoke,31
4005,gener seroxat in question,45
4006,mépronizin how,30
4007,ludéal gen is a gener dian,45
4008,i wonder if trinordiol tend to aggrav acn,28
4009,the mysolin did she amm for essenti tremor,31
4010,dexamethason offici info,22
4011,can you get pregnant by have an iud mirena,48
4012,the ostenil is it refund by social secur,47
4013,im a virgin so is the vaccin against cervic cancer is effect,9
4014,what zoeli as phlebiti risk statist,28
4015,what serv the phosphoneuro,31
4016,they lose ani weight with 20mg proza i do not understand i do not,28
4017,as follow rifinah ha pulmonari tuberculosi i have to take treatment on an empti stomach how long befor take the treatment then i take my meal snack,38
4018,i take the mélian yesterday i wa suppos to start my plate after the week off and i oubliéc even i took the pill yesterday today but not at the same time 1h of meanwhil about or had to take 2 tablet simultanémentest it seriou,12
4019,what medic for irrit to the eye,32
4020,aurum muriaticum 9ch,22
4021,cerazett and hormon disrupt,28
4022,you know a remedi to digest,32
4023,is methadon cross the placenta,37
4024,what are the side effect and cosopt xalatan,28
4025,the seroplex what is it,22
4026,i took a lot of weight by take zoloft for almost a year what to do,11
4027,stop seroxat sensat in the head,21
4028,for one week i take paroxetin i sleep there t there someon that ha to happen,28
4029,valerian tinctur the spring it through the pore,41
4030,is there a way to take dolipran same time as the valtrex,34
4031,sertralin what danger,48
4032,contalax,22
4033,seropram until a child,44
4034,i took most of zoloft pregnanc and my doc to sleep i give 100 mg to 150 mg desyrel trazodon is taken at bedtim with 1 mg of ativan what are the risk to the babi,44
4035,gentamicin and risk of deaf,48
4036,i forgot to take my pill trinordiol but i have notic within twelv hour i take my pill to 22h and there i took around 9am i am worri,13
4037,antidepress are they respons for autoimmun diseas,28
4038,my doctor prescrib me as forlax 4g and i forgot to tell him that i wa oper on for intestin obstruct 1yr ago is that i can still use thi medicin,44
4039,zoloft at fourteen it is possibl,44
4040,luteran dosag,42
4041,i take seroxat for the 2nd time i feel extrem tens again tens i wake up again at night without be abl to sleep again thi loss of power and the insomnia they are normal after a week of calm,28
4042,temesta to sleep,31
4043,i just start effexor i wake up everi night which never happen usual i feel nervou and abov all im not hungri anymor similar experi,28
4044,my doctor give treatment which myolastan thi time at the first shot i had a veri big allerg reaction is thi normal,28
4045,of seroxat in prozacl have the undesir effect of the begin,10
4046,i take the pill cilest and then i had a littl stomach ach i also have my rule when i have had to have sunday 29th or monday 30th januari what should i do,11
4047,i wa under adep but here 5 month i spent in jasminel and sinc thi chang my rule are less import see veri veri discreet is thi normal or should i rather inquit me accord to you,28
4048,can i take crestor tablet out of it blister sinc 1 week,16
4049,topalg addict,28
4050,yasminel it prevent ovul or not,37
4051,what form ha the nocerton 60mg,30
4052,what taken if ultradouloureus rule,32
4053,dolipran risk of addict,28
4054,seroxat posit effect ​​when,23
4055,as propranolol i decid to reduc the amount gradual but i wa victim of an ill accompani by an intens feel of warmth loss of balanc and a vision disord do you think that lower amount of betablock can caus thi kind of discomfort,21
4056,meningitec who know,22
4057,there there ani risk to chain pad holgyem,48
4058,is that an anti depress caus a ruptur aneurysm,28
4059,what is the remicad,1
4060,is what may be an iud copper outsid the rule,14
4061,what are the less miness,28
4062,hello im on the pill sinc 4yr trinordiol and thi month i stop 24 to resum tomorrow and i still had noth except a slight pale pink mark on the paper i did not forgotten i get ask lot of question is what it is alreadi happen to you thank you in advanc and good birthday,28
4063,my homeopath prescrib me zinc granion to take 2 time a day he must be taken prefer away from meal or even,38
4064,littl question about strepsil,22
4065,efflexor morn or even,38
4066,under antibiot alcohol,33
4067,elimin lepticur be done by renal or hepat system,41
4068,i alway have to take two tablet capsul tetramys but catch should not be done dure the meal i would like to know when i could take them optim know that i have to make 2daili capsul,38
4069,a dermatologist retir doctor want to know the date of return of daivobet cream,24
4070,jasminel forget a tablet 24 hour of forget what do i do,13
4071,i have a patient who bring me 2 prescript children 2 month and 25 year for bexero what is it indic and it use,31
4072,ibuprofen is it danger,48
4073,seropram j10 to when the posit effect,23
4074,what is the gener plavix,45
4075,can you find the tp or dtp vaccin in itali,29
4076,my doctor prescrib me of coffea cruda 15ch for sleep disord yet i read everywher that for thi caus these 9 bedroom you need what is the right mix,42
4077,urgent j 5 after stop pill cerazett and no rule normal,28
4078,i alreadi took seroxat ago 3 year over a period of 1 year and a half without ani worri again i am thi treatment for a lil while just over one month lau after 3 week i start to have plate that demang me ca ca scratch and swell it been like nettl sting on the skin i saw the doctor and he gave me the aeriu to take anti allerg i just start thi morn and it true that a calm my hive on the instruct of seroxat ago note for advers effect veri rare skin rash is pourkoi i wonder if my concern did not relat to my anti depress can be that somebodi ha alreadi encount thi troubl,28
4079,can you tell me if ixel is efficass for lute against the black idea,31
4080,the exomuc is it refund,47
4081,have you had ani side effect after take norlevo,28
4082,posotif effect of prozac not all day,26
4083,i just take 19g of paracetamol i risk it,48
4084,the pill is adep it a higher dosag,22
4085,i want to know if i could take my pill a littl earli 30 min i read that it wa possibl but i like to know if the next day i had to take it at the same time and whether the contracept effect is still preserv,14
4086,how to treat athlet foot in a child of 2 year,32
4087,if you are pregnant it is safe to take luteran,44
4088,vic babybalm off the market,24
4089,i have to do to hepat b vaccin but im allerg to egg i want to know if ani trace of egg she is present in the vaccin,5
4090,clomid it is normal to have abdomin pain,28
4091,you know drop to cure the hiccup,32
4092,is what ghb treat anxieti and depress,32
4093,is what i can buy without prescript biomag,8
4094,what duphaston,22
4095,is what microv is effect from the first dose what doe it matter if i start the plate while i do not have my rule again,39
4096,are there ani side effect dure the first week of seroxat sweat anxieti attack,28
4097,how to prepar hepar magnesium d8 and hypericum auco cultum d3,36
4098,have you ever had ani side effect with varnolin,28
4099,nexium prescrib me what are the side effect caus you ca,28
4100,what zenalia,22
4101,roacutan question,22
4102,lutenyl for 13 year old,44
4103,i would like to get vaccin against the flu but im afraid if i do my vaccin these day not to be immun in februari,26
4104,and repevax what do you know,22
4105,hello i take the pill pacilia ge 6 month now i have to take my pill for 20 day and then take a break of 7 day i want to know if dure thi period of 7 day i could have relationship with my boyfriend thank you in advanc for your respons,26
4106,again i would like to know if it is necessari to take paroxetin daili at the same time,38
4107,mélodia forgotten what,13
4108,i take the pill cerazett and i bleed for 1 week how is thi possibl with the woman bodi,28
4109,i took my pill twice a day what do i risk,48
4110,can we prescrib izalgi dure pregnanc,44
4111,what chang are observ in stop the oral contracept,28
4112,can we take virlix dure pregnanc,44
4113,nausea with zoloft,28
4114,is that i can take paracetamol for the pain,31
4115,one patient wa prescrib eg amorolfin 5 by hi doctor but he did not specifi dosag she want to know how often to use the product,42
4116,how to know the dosag of griffonia,42
4117,is q i can take 28 tablet mercilon of a sudden instead of 21,42
4118,hello i take prozac for just over two week sinc qq day i have troubl breath im like oppress unabl to inspir deepli do you have the case what do you think,28
4119,cymbalta to you t he lose weight,28
4120,unbear hive and xyzal,28
4121,senior treatment arimidex,18
4122,how much cost the box biomag,46
4123,the clever need inform pleas,22
4124,hello t pk give you these medic associ tegretol 400 and haldol thank you for answer me,31
4125,i ask if i could take stresam valium and at the same time,34
4126,lost weight with seroxat,28
4127,i gradual stop deroxat but i sensat of electr shock is thi normal,21
4128,surgeston the pill what is it,22
4129,topalg addict,28
4130,becaus pharyng my doctor prescrib 2 spray rhinofluimicil three to four time a day the manual is not clear can you enlighten me,14
4131,we want to give me 6 cardenciel 20mg for one night is that there will be side effect,28
4132,androcur is a medica for what,31
4133,celebrex box of 28 or 30 tablet,6
4134,i take luteran my gyno told me to stop and offer me the iud mirena he ha been someon in the same situat as me how the iud it support,28
4135,i like to know if i can replac one dose in 9 hp thymulin dose of 5 granul thymulin in 200k or other resolut,0
4136,i read in the instruct that if a tablet from day 814 wa forgotten we must take the miss tablet and finish the plate thi mean is that i have to take the tablet of yesterday and that of today at the same time,13
4137,i took stablon for 15 day consécutifsbcp side effect of my med arreterspntané told me there 1 week and sinc i have nausea and 1 bit enervé is thi normal,21
4138,do i take my treatment with ciprofloxacin in the morn,38
4139,estima gen what,22
4140,i take sipralexa for 1 year i start to feel better after 6 week but sinc thi winter i am veri tire again sometim i do not have the strength to do certain thing i must say that i increas my dose of anti depress for 7 joursalor is that these are the anti depress which also make me lame or is that symptom of depress,28
4141,forget pill cerazett risk,48
4142,i begin with apprehens chemo thursday that combin gemzar cisplatin is what someon know and can tell me,22
4143,seroxat can solv the problem of prematur ejacul,31
4144,voualai i know that s stay are the undesir effect of guronsan,28
4145,it may take st john wort and bach flower at the same time,34
4146,i am under ludéal for two month and i have to go to qlaira what is the instruct break or no break,10
4147,infanrix booster imper quinta in 3 month,14
4148,dian and hypertens,43
4149,how the cervic vaccin,37
4150,how to cure a spirulina,14
4151,euphytos no prescript,8
4152,interact between xeplion and caplet to lose weight,34
4153,issu melodia,22
4154,hello i am under mercilon for 4 month but i have a hair loss problem that what i do thank you in advanc,11
4155,what shape are the tablet of 200mg celecoxib zentiva,30
4156,the seropram make you fat,28
4157,after instal my iud i had small brownish loss with cramp etc should i worri or thi is normal,28
4158,some question about dian 35,22
4159,what are the effect of provam and cyproteron acet from,28
4160,i take the capsul milleperthui 4 day my question is when should i take them,38
4161,can i take dolipran with valtrex,34
4162,i wonder if it is possibl to feel the effect of the reduct of seroxat just 1 12 month after thi is 2 week i feel these effect and it is get wors is thi normal,21
4163,i wonder if other peopl have heard of or use the vaccinotoxium dose to releas toxin vaccin,31
4164,can we get isoror without prescript,8
4165,deroxat make you fat,28
4166,can do we inject syntocinon a person who make a bleed,43
4167,spotof prescript,8
4168,seropram lysanxia babi test,44
4169,what is the recommend initi dose for modafinil,42
4170,i wa previous faverin 100 mg per day 2 tablet and for 15 day i switch to 75 mg i now feel feel evil what to do,11
4171,can i use my cream emla expir two week,19
4172,dian 35 can it be issu to famili plan,8
4173,the clever need inform pleas,22
4174,i would also like to know if thi is normal if i have brown discharg with trinordiol,28
4175,i recent took the oenobiol aquadrain which expir in april 2005 the caplet are they still activ,19
4176,the oscillococcinum box 20 pellet,6
4177,im allerg to curar mivacron is there a risk if i take morphin,43
4178,is there are peopl who screech halt treatment without hair back exec or button with androcur,28
4179,i current take risperd 4mg morn and night and i feel veri strang i walk strang i feel hover i speak as if i wa drunk i want to sleep but not alway is to sleep that these effect are alreadi happen,28
4180,i take dolipran 100 mg per day make a total of 15 00 mg dolipran in 15 day what are the consequ,28
4181,effexor 50 tremor,28
4182,the goon synvisc is there a prescript reserv for certain specialist or gener practition can prescrib it,9
4183,laboratori test which the introduct of xeroquel,2
4184,are there a lot of advers effect with risperd,28
4185,who is the theralen,31
4186,thypoïd and immurel vaccin are compat,34
4187,i must stop microv to start daili but i do not know when becaus i am not well adjust level bleed i have to start when,10
4188,dolipran nifluril,34
4189,copper iud as contracept,31
4190,microvi,22
4191,i start mélodia i wa repeatedli subject ha to ashm attack and asthmat bronchiti is there ani indic con,43
4192,florgyn is danger,48
4193,are there a risk not to the rubella vaccin bi befor pregnanc,48
4194,melodia her breast swell and hurt himr thi normal,28
4195,tercian i eat less and i saw eye grow whi,28
4196,good even ye ye ye usual a question about thi vaccin ha a daughter aujourd hui is a young man pose for a close friend my girlfriend had her first sexual intercours there are over a year hi mother aujourd hui insist she doe thi vaccin she doe not dare say no fear of reaction what are the risk to thi vaccin and have hi first sexual relationship there are over a year except the nonoper of the vaccin what are the risk thank you for your answer,28
4197,can we take seroxat lunch,38
4198,bactrim syrup for a child of 13 40 kg suffer from cystiti what dosag you put,42
4199,locabiot tussidan and dure pregnanc,44
4200,ignatia sepia gelsemium and dure pregnanc,44
4201,i wonder if it is possibl to take the essenti oil gelul,6
4202,is continu varnolin caus undesir effect,28
4203,whi forget pill more than 12 hour can give a risk of pregnanc while dure the instal of up to 7 day you stay protect,37
4204,baldrian to sleep is compat with champix,34
4205,i take the pill jasmin around 22h i took my pill but about 2 hour later i had a new attack of diarrhea which is chain all night we must take a pill but know that i wa go to have a new crisi i have not taken i had a report unprotect 3 day befor is there risk of pregnanc,48
4206,do neoral is in the form of soft capsul as in other specialti i did not like thi form,30
4207,logiflox consumpt onc the expir date pass possibl,19
4208,what are the gener dian 35,45
4209,cymbalta is what caus fatigu,28
4210,melodia arct,44
4211,kelkun he ha a solut to stop the rule,32
4212,paroxetin dure the meal,38
4213,i would like to know if these two drug to cardiocalm plant hawthorn and prepaus chast tree ladi mantl yarrow are compat togeth,34
4214,i wonder if the fact of start the pill the 2nd day of the rule would have a risk of get pregnant,48
4215,i just realiz an idr my bcg vaccin normal read the result after onli 72 hour after 8am here i am with indur of over 10 mm is that i understand that i may be infect,37
4216,after wean rivortil is what we can take laroxyl,10
4217,adep give vomit,28
4218,it true that adep is highli dose,4
4219,i took an antibiot rifampicin i have read that the combin of rifampicin and the pill mine daili gen wa not good is that the case,34
4220,hello i take the gener pill dian the 35 and i forgot 2 or 3 time in the month of may but i got my period june 4 as usual without delay but sinc 2 day i have brownr loss and i have a stomach ach and there is a week of that but i vomit wa not realli vomit final it wa weird dure her forget i had unprotect intercours id like to know if there is risk of pregnanc or not but desir a child i fear it is a fals pregnanc thank you for answer me see you soon,48
4221,solian and ritalin,34
