ID,question,intention
6016,i take the pill melodi from thursday april 24 my appoint with the gynecologist and thi morn i have red spot on the chest is that it relat to the pill or a stroke of stress i await your respons eagerli jennif thank you in advanc,28
6017,i take the pill desorel 20 and i made my 7 day and stop them my fals toujour pa rule esqu it normal not to have saignemen dure the 7 day stop,28
6018,then i take iron along with the folic acid and duphaston,34
6019,who know the lithium,22
6020,ge daili pill risk,48
6021,it ha a high walk boot prescript for tibia fibula fractur we redirect the patient to the doctor for the instal,8
6022,forget dian 35 4th day what to do,13
6023,cerazett support,47
6024,i got surgeri on a disloc jaw i am under l72 but i stop becaus i sleep veri badli i have troubl fall asleep i wake up more tire what should i do,11
6025,if breastfeed uvesterol what do we deliv adec or d,44
6026,is it true that there is a vaccin against fungal infect in germani,29
6027,my my dermatologist prescrib terbinafin i like to know if the side effect are common,28
6028,i am enorm stress becaus problem of coupl what medic can i take to relax and not to burst into tear at everi hassl,32
6029,i final found a salv that sooth my dri eye api mellifera 8 dh dh 3 calendula officinali euphrasia officinali dh 3 yy qs 1 vial the professor who follow me for the syndrom and my gener state told me that calendula is thrush,31
6030,prozac is one list,8
6031,hello and thank you to those who auron prisl time to read and answer me here i explain the problem i take the pill adep and i c c is not quesqui pass but with the stress of my exam and problem with my darl i have forgotten some pill i alor c exactli but i took my pill wholesal 1day 2 from the 11 or 12 pill arriv aa 16th i did not know at all or j in the summer and ive had my rule that are 3 day and most ren c ca stop bizar pasqu my rule super long last normal about 7 day mm with the pill briefli here i c the more and more i have bad o belli as it pull me down here i more or c jm actual on my cycl someon help me a littl tell me if it care alreadi come and when i have to take my pill well i think that there are not a risk of pregnanc becaus dure my period of forget the love we make the 1 time a tt peter therefor i think that there are not a risk i ask your opinion becaus i am asham to see my doctor knew that i had an abort are 9 month thank you,28
6032,i learn thi morn that i wa pregnant know that i took nurofen saturday and sunday ect are there risk,44
6033,i am under luteran im at 15 day and i again rule weak but rule still thi is normal,28
6034,mildac alcohol,33
6035,good even i wa take seroquel sinc 2006 200 mgen 2012 i decid in agreement with my doctor to stop gradual month my bedtim dose wa 50 mg thi molecul is my take 6 kilo do you think those kilo that i n not get lost depart shortli after the end of treatment or not,27
6036,there he had the same treatment activelle®,0
6037,how temp doe it take for xanax dizzi go under,27
6038,3month pregnant i took dure 1 week dolipran and toplexil what are the risk for the babi,44
6039,the vaccin for influenza on a dual zone ordin in ald part is it support by the fund for a patient,47
6040,forget mélian take norlevo risk,48
6041,i take the last 7 day efferalgan 1g 3 time is it danger to take that long,48
6042,jasminel lowdos pill,5
6043,the zoloft about gener anxieti disord,31
6044,takadol durat of treatment,42
6045,after how long can we regain sargenor,42
6046,it take a prescript to buy a dt polio vaccin,8
6047,1 week ago i took the patch evra it is off sever time and i pick what to do,12
6048,what type of atd is effexor,4
6049,advil medicin,22
6050,you know the argel7 massag gel thank you,22
6051,i like to know if the medic zovirax the same molecul that are refund i am under valtrex 500mg for 1 year at a rate of 104 euro per month minimum with no refund mutual she will take over the differ,47
6052,i have a prescript for a mouthwash with inject morphin bicar and i have a doubt about the regul we can repackag inject morphin,6
6053,it may take you cortison same time as prednisolon,34
6054,hello everyth s i wonder if take 12 tablet risperd 1 mg it is seriou im 15 thank you,42
6055,tigreat what say,22
6056,how long can i use nasonex after open,16
6057,what solut to replac dtp,0
6058,i had a judgment of 7day pilltak i had to take 1 tablet of my plate friday and did take that saturday should i protect myself,48
6059,someon alreadi took champix to quit smoke,31
6060,do you know if the seroxat is fatten,28
6061,conserv amoxicillin 250mg syrup,7
6062,get pregnant under duphaston what risk,48
6063,cycléan 20 per pill how to start,14
6064,gener ciali,45
6065,how long to wait after the stop cerazett,14
6066,i almost daili use vogalib against nausea i wonder if it danger for my health,48
6067,after melodia forgotten what,13
6068,xalatan can be taken dure pregnanc,44
6069,pharmacodynam betaserc,41
6070,the doctort ha it the oblig to mention the pharmacist who will deliv the stilnox,9
6071,at what treatment class belong lepticur,4
6072,the effexor it can caus a augmentass potassium,28
6073,what is the dosag of oliv leaf olea europea,42
6074,i wa inject with morphin sinc that day i have a headach when i make certain movement do you think that will be relat to morphin,28
6075,i start miness for the first time and my period have just finish i want to know if i can now have sex without jog risk fell pregnant i brows the forum and discuss 7 day sometim and other time it is activ for the first take i do not know what to think,23
6076,can modopar caus alopecia,28
6077,how to separ me valium,0
6078,with sertralin there there much differ between take 50mg daili and 75mg,42
6079,what is the dosag of laurel wet inhal,42
6080,microv can drive the vehicl,33
6081,whatar take dexorat,31
6082,what is the pretherapeut assess to be done befor the initi of treatment with gilenya,2
6083,i can not toler antidepress st john wort,0
6084,i want to take th after how long doe it effect,23
6085,i wonder if the new influenzinum is avail in pharmaci now,24
6086,is it possibl to shift the rule with microv sinc there is no stop between the pad,14
6087,i ask myself a question about the gardasil vaccin social secur doe reimburs fulli the 3 inject,47
6088,what is the spasfon,31
6089,i am under ofloxacin i wa veri ill the right shoulder just someon tell me more,28
6090,ge daili while breastfeed,44
6091,should we make a ophthalmolog assess befor start treatment with gilenya,2
6092,i took dian 35 pdt 10 year and i would like to have a babi combien long doe it gener to get pregnant,21
6093,emla patch appli how long befor the vaccin,15
6094,renouvel prescript for roaccutan,8
6095,when i take ibuprofen can i take alcohol too,33
6096,i did overdos lightweight 8gr3 paracetamol some propofan too 6 day after my first overdos i swallow 10 gram of paracetamol two day later i swallow 4 g of diantalv then monday 7 gram of paracetamol tuesday 305 gram of paracetamol 5 diantalv wednesday 65gr thursday 8 gr friday 8 gr saturday and sunday 8 gr everi day two day later i take 8 gr 4 day after i swallow 8 gr thi will be my last tablet and it been a month sinc i no longer take ani medic combin cost much less in overdos druginduc hepat can aris month after 1 while the drug ha been implic ha been remov concret i risk qlq thing or the worst is behind me,48
6097,i have palpit with actif what should i do,11
6098,i take the pill mélodia becaus i do not suportait jasminel thi pill is a continu engag with 4 tablet inact i am not have my rêgle how should i put take thi pill not to have them,14
6099,i have a problem with a doctor who prescrib the instanyl to a patient everi 15 day for deliveri 28 day how to deliv,8
6100,how dilut tinctur,36
6101,how long the effect of effexor if he dissip,26
6102,propranolol against anxieti,31
6103,c how the normal dose of seroplex,42
6104,laroxyl who know,22
6105,i spent the ointment décontractyl which is a muscl relax for 5 day after you stop i had a sever hive big red and thick plate accompani by sever itch and burn i am célestamin locoid sinc 5 day is that it is a compon that can be décontractyl behind the hive is it possibl that i do an allergi,28
6106,trinordiol as it happen to me to chain 2 platelet by link directli with the last color tablet but i just realiz that i had taken the 2nd entir wafer that i had blood loss everi month it can be a sign of someth,28
6107,my doctor prescrib lariam as antipalludéen side effect are so terribl the effect depress,28
6108,can rivotril be use in a myasthen patient,43
6109,chikungunya affect the meet a colleagu told me about the ledum malaria 9 c is that the dose of 5 tablet per day also appli to children,42
6110,i am under mélodia befor under tricilest and it did a few day that i have saingement while im in the middl of the plate anyon have ani idea is thi a sign of someth,28
6111,i am under seroxat 20mg is it realli hazard to health,48
6112,a current treat by escitalopram crister patient wish to reduc the dose gradual to stop hi treatment so she cut the pill in half can it continu,12
6113,i am under prosac and becaus of thi i chang bcp person i have more motiv to studi i larg unpolish insensit and honestli i have more interest in anyth and i begin to feel sad for thi state someon he know thi state,28
6114,i went on the weekend and i forgot my misfortun wafer cerazett result here 2 day that i have not taken my pill what should i do take 2 pill and take one tonight at the usual time know that i would not report for a week becaus my boyfriend is on a busi trip,13
6115,seroxat eat,38
6116,i must make a point of polio vaccin dt revaxi i want to know if i could do it myself at what point should i bite,14
6117,trinordiol if not taken 12 hour after regular time,13
6118,i recent left for trinordiol jasminel unaccustom to the new present board i forget the 5 pill last week after have read the instruct jasminel i took my pill normal 7 day i am about to resum a new wafer the 2nd from oblivion but i like to know what is best to do everyth to be normal stop the pill for sever month continu to take normal,13
6119,mélodia side effect how long,27
6120,depend to tramadol,28
6121,whi take seroxat,31
6122,what supplement for iron,32
6123,what colchicum,22
6124,a patient want to know if she can smoke with take azilect 1mg,33
6125,atarax side effect in the long term,28
6126,longterm hazard prozac,48
6127,gossess and ventolin,44
6128,humatrop is it prescript onli,8
6129,i have asthma and am under seretid and flixotid everi day do these drug can have an influenc on my potassium level,28
6130,prozac and p450,41
6131,i am under seropram for over 5 month and i feel that i have physic effect tingl disturb vision headach when i sleep depriv can we find out about thi,28
6132,which is the fastest dolipran suppositori or syrup,30
6133,advil dolipran efferalgan lisopainej can,34
6134,about the celestèn question pleas,22
6135,the contracept luthényl he ha troublesom effect,28
6136,is it normal to prescrib vitamin k to a babi who is not in breast milk,44
6137,guronsan is what is danger,48
6138,risperd what dosag are avail,25
6139,norset and weight gain want to eat more,28
6140,take glucosamin and silica compat,34
6141,after month of treatment with granudoxi my dermatologist prescrib me tetramys i alway have to take two tablet capsul onli catch here no longer have to make dure the meal but outsid know i lift weight and i regularli eat 615 10h 12h 16h 19h let me know when i can take optim capsul know that i have to make 2daili capsul,42
6142,i know im ask a copper iud midmarch to thi day i still do not have a regular cycl after how long your cycl are regular they becom,27
6143,thi is the gener drug clopidogrel what,20
6144,lutenyl effect from when,23
6145,subutex and methadon same indic,31
6146,miness side effect,28
6147,copper granion in infant,44
6148,i got instal mirena in septemb 2001 when should i chang it,14
6149,harmonet it is refund,47
6150,dolipran and pregnanc,44
6151,dolipran risk of addict,28
6152,hello know you medic or spray against snore,32
6153,can i get a spermicid gel without prescript,8
6154,at an establish of metoject 10 it is essenti folic acid,9
6155,someon know a treatment for veri regular contract and torticolli onc or twice a week,32
6156,we just stop for bustar lisanxia ​​there doe not it too withdraw problem,21
6157,4 imovan day then i increas,42
6158,doe anyon ha had secondari effect with chast tree,28
6159,i wonder if after the first pill taken lumalia contracept she wa or had to wait,23
6160,biolectra magnesium 240 strong what,22
6161,i take seropram 2 per day my doctor told me to put togeth so 25 per day it get better but it not the top do you think he had to climb the ad,42
6162,im on the pill daili ge i realiz thi morn at 6 am i forgot to take the pill of the 14th day do i normal keep my take pill and do my break normal,13
6163,dian 35 under the sun,33
6164,back when the infanrix quinta,24
6165,at what age can prescrib dapi stick boiron,44
6166,what to do against the myeliti,32
6167,i use copaxon for 3 month and for 2 day i have red patch that appear on my bodi is thi normal,28
6168,i suffer veri strong headach i would follow a treatment background homeopath could someon tell me the track pleas,32
6169,i forgot to take the first pill from my plate can i start with a day of delay while be protect,13
6170,pill and alcohol is bad or not it,33
6171,what is ponstyl,22
6172,there are egg protein in the mmr vaccin,5
6173,what side effect clozaril,28
6174,augmentin alcohol is danger,33
6175,who is leeloo gen,31
6176,is it safe to get vaccin for the flu,48
6177,valium and seropram it go togeth,34
6178,what specialti are avail for sore throat other than syrup or lozeng,32
6179,seroxat begin 1 to 2cp,42
6180,i am current take a bottom tt e150 mg epitomax to treat my headach should we stop treatment in pregnanc,44
6181,alcohol and antibiot,33
6182,i want to ask me the iud mirena i wonder after lay the iud you had your rule for how long quantiti normal rule for spot 58jr then,37
6183,i take xanax 050mg the initi dosag is 0 tablet if i feel good if it go blah 1 and 2 when it goe wrong follow a person problem i took 3 tablet and i wonder if there may be consequ,48
6184,takethi is kind decongestionen dolirhum it against state with take steroid,34
6185,stresam he use to sleep,31
6186,i would refer you to a friend who excit person problem with seroxat do you have ani evid,28
6187,know you drug against the acn and oili skin,32
6188,take overdos dolipran danger,48
6189,what is the name of the gener melodia,45
6190,trinordiol main side effect,28
6191,i got my period 10 day after the begin of my daili ge wafer thi is worri in your opinion,28
6192,that is forget the previou month make my pilltak qlaira ineffect,13
6193,what is the stimol halflif,41
6194,how to shift these rule with evra patch,14
6195,i usual take minidril but today the pharmacist gave me ludéal gen thi is the same pill,45
6196,i notic today around 10 am i forget to take my pill last 3 platelet monday tuesday wednesday and i had unprotect intercours on wednesday and thursday morn do i have a chanc of pregnanc,48
6197,today i am veri stress and i would regain calcibron can i get it in pharmaci without a prescript,8
6198,paxil is it stimul,22
6199,what is the altern therapi for break monoprost,0
6200,hepat b vaccin mandatori,1
6201,what are these drug ampicillin and clarithromycin,31
6202,lamisil singl dose can it be use to hand,14
6203,question about lutenyl,22
6204,16sa enclosur and ca do 7moi who vaccin me rubella do you think thi is too earli for the vaccin to both,23
6205,grignottag to stop the stress he had to take ignatia amara in 15ch but the problem is that i do not know how granul or how mani time day,42
6206,who can prescrib clozaril,9
6207,i buy my vaccin against influenza yesterday influvac when do i get the vaccin,14
6208,is that evra patch is avail in quebec,29
6209,how long to wait befor the effect of prozac,23
6210,i want to know if zoloft made you gain weight,28
6211,lose weight with minidril is thi possibl,28
6212,i want to put my patch evra top of the buttock howev i put it rather in the lower back do it can be a problem,15
6213,seroplex,22
6214,my gynecologist prescrib me duphaston becaus sinc i stop take the pill my period have not return the problem is that i do not understand the order and i do not want to rememb becaus it is unkind when should i take it doe anyon ds is my situat thank you,38
6215,the dostinex can it be danger,48
6216,i have to vacin hepat are onli told me that it wa done in sever inject are that true thank you,42
6217,there is hormon replac therapi that doe not gain weight,28
6218,which diseas exactli cover infanrix tetra,31
6219,doe the donormyl can caus vomit in a pregnant woman,28
6220,vaccin and pregnanc,44
6221,when should i take seroplex,38
6222,haldol dodo normal,28
6223,is what can make a cure of vitamin and miner and take antidepress,34
6224,i want to know if adep make you fat or make you want to eat,28
6225,the zoloft sertralin becaus he posit effect against toc obsses repetit thought,31
6226,what is the action stimol time,23
6227,i take miness and i forgot wednesday night and thursday night i am report friday morn yesterday i took a pill in the morn and even and today like to catch up with 2 pill but what the bodi can handl 4 pill in 2 day,12
6228,foreign order of rivotril can deliv,8
6229,woman urinari infect what to choos as an antibiot,32
6230,lutényl and pregnanc,44
6231,the pharmacist gave me kalium bichromicum 5 ch for my daughter margot 6 month 85 kg cold how to give him,42
6232,i swollen tongu when i take paracetamol who littl help,11
6233,my son is on nose and cold cold pediatrician advis me the oral vaccin is that it been that it exist,18
6234,i want to know how is the clomid on a man and i expect a consider increas in testosteron,37
6235,im in my 9th month of pregnanc and i suffer from hemorooid you know how mani day i have to make pellet,42
6236,a pharmacist ask about the reimburs rate mircera,47
6237,belladonna who use it and whi,31
6238,xeroquel sleepless frequenc,28
6239,not to forget my pill cerazett i have it taken 1 hour befor the usual time thi is someth good that ive done or ive made a silli thing,42
6240,biceptin in the eye seriou,48
6241,mercilon is a minipil,22
6242,sweeti got her first vaccin prevenar thi day is gronchon bcp cri want arm sleep veri badli and especi eat littl veri littl pouvez you tell me how long they can last,27
6243,can we take augmentin 1g dure pregnanc,44
6244,i want to know if the wort would work well for anxieti,31
6245,weight gain is a common side effect it stablon,28
6246,i want to know who among netizen took cystein ​​lobamin and had a disrupt in the rule,28
6247,2nd plate optilova no rule,28
6248,what is the felden,31
6249,vaccin against hepat ha,32
6250,take do we systemat weight with seroxat,28
6251,what is solian,22
6252,expect mother can they take mopral,44
6253,effexor desir to be a babi or not,44
6254,that take to pass a post partum depress,32
6255,children under minirinmelt treatment,44
6256,19g of paracetamol i risk it,48
6257,hello it is expect that i take the pill jasmin soon i do not know well carectéristqu but wa told that there wa no smoke or i smoke for two year what are the risk and effect thank you,33
6258,the drop in cyclosporin 05 is avail in town or in pui,8
6259,vaccin to prevent tétanost,32
6260,how long after cessat of flagyl ™ is it possibl to drink alcohol,33
6261,is that urbanyl is effect for seizur,31
6262,is that someon might find out about the consequ of stop the pill miness do our hormon take time to resum normal activ,21
6263,trinordiol and time taken,38
6264,about how much a box of 100 or 30 tablet tranquit,46
6265,paracetamol can it be danger all jr,48
6266,hello,1
6267,i have alreadi made two inject of the vaccin gardasil and sinc my moral condit deterior what advic me,11
6268,pyostacin to fight nosocomi infect,31
6269,what to do to prevent flu in children 5 year,32
6270,i just take dupahaston to better regul my cycl i have rule tcf more abund than usual known effect is weight gain can be a side effect,28
6271,gener version of cycléan 30,45
6272,veri abund rule with implanon i wonder what is the solut,11
6273,tegretol price sticker,46
6274,gemzar who know,22
6275,i wa on the pill cerazett for 3 month then i drop below carlin20 on the instruct of pug 20 it mark that the rule must be effect within 7 day of take the first pill out it been over a week and still noth can i be pregnant,48
6276,ror alccol vaccin,33
6277,birodogyl and noroxin,34
6278,i wa under zoloft but it work the doctor prescrib effexor 75 mg 1 tablet in the morn after how long it is in effect,23
6279,i am have mount anxieti muscl spasm mean tenfold depress weak passiv sad after stop lysanxia am i wean,21
6280,what is the price of rosavastatin,46
6281,mildac in depress or small depress,31
6282,i had unprotect sex and i forgot my pill so i took the morn after pill about 11am to 12pm no more after the unprotect sex it wa written on the note that for maximum effect take the morn after pill ds 12h after the relationship in my case is that the effici is good even if it is just 12,13
6283,i gain weight 2to 3 kilo in lutényl i wonder if someon and in the same situat as me,28
6284,how is botulinum toxin,37
6285,at the stop cerazett is that the menstrual cycl is long to return,21
6286,take anti psychot can creat problem in those who took them into long term and want to stop to the drug or the set time hallucin and voic for exampl,28
6287,fucidin leo she contain fusid acid,5
6288,take valium 15 mg day is there a risk of addict,28
6289,hello i will like to have testimoni from girl who spent 35 of dian yaz how you paid at least dian how you support yaz for my part i have to start yaz next month becaus after 6 year dian and almost 10 kg more taken dice 1 month the doctor decid to avoid take more becaus thi is what happen as soon as i do more attent it wa better to stop by against total anguish becaus dian wa veri effect against the acn so dr promis thi is a test if the button back there again dian but good thank you,28
6290,what can be done to sooth insect bite,32
6291,more effect with dexorat what,11
6292,i lost my pill plate daili gen it remain abov the last charact that i do not wa abl to take my rule were advanc 1 day is what i have to start with the next pack one day ahead compar to usual thank you,13
6293,avastin anyon know,22
6294,i would like some inform on vaccin infanrix quinta and includ what is cover or not,47
6295,what microv,22
6296,hello i take solian for 1 year and half 50 mg for anxieti disord and i decid to stop becaus of a particularli troublesom side effect is almost complet loss of libido i do not have ani sexual desir everi day sinc i took it and sinc i have a girlfriend recent i wish my libido back my psychiatrist prescrib me the apro instead 1mg and i take it for 2 day but for now the desir is still not back do you think it take some time befor the side effect solian of disappear,27
6297,tea compat with wort,33
6298,stablon new regul,8
6299,dian what is it gener,45
6300,im depress for 2 month and my doctor prescrib the 30mg témozépam to sleep and wa told that it wa not advis for peopl with depress is thi true,43
6301,i vaccin my 2 pt end of 2 and 4 year with these vaccin all in one and i read testimoni on small who have the vaccin and who develop ill not veri pleasant shortli after should i worri about their futur or the side effect they arriv in a fairli short time,27
6302,seroxat i read that thi is the worst in term of sexual side effect especi men complain of not have an orgasm what is it,28
6303,i wonder whi it is so import to dissolv a efferalgan in a glass of water that would happen if i swallow a pill like that,36
6304,mélian bp or not,28
6305,the pharmatex spong are they avail anywher,24
6306,mirena 8jour withdraw from heavi bleed,21
6307,what problem expect with trinordiol,1
6308,we just prescrib me 10mg notran is it realli a somnifer,31
6309,how therapeut class belong risperd,4
6310,im in my gényco duphaston and just pass the dose of 1 tablet 2 tablet daili sinc that night i like stomach cramp is it may be relat,28
6311,my babi ha a rgo and lack of motil of the digest system it hard to evacu it burp what can i give him to help evacu,32
6312,crohn diseas can i receiv tamiflu,44
6313,a patient wish to know the common dosag for vogalen lyoc,42
6314,effizinc and pregnant,44
6315,for over a year i have the implanon later i had my rule normal and for some time i have my rule for more than two week and they are veri abund i wonder if some of you are experienc thi kind of problem,28
6316,what to do in case of side effect with tolexin,11
6317,hello my doctor prescrib seroxat for my anxieti follow a long ill onli here it is 4 day i take and i feel like a backward and syptom retriev my ill i think i prefer stop seroxat i wonder if 4 play my bodi is accustom to the molecul believ that the stop will be pain i hope you will repli soon thank you,28
6318,paracetamol and pregnanc,44
6319,aspirin as an antidepress,31
6320,biafin in germani,29
6321,from how long one can have sex after administ colpotrophin,12
6322,what nexplanon,22
6323,there ovul despit take norlevo is there a risk,48
6324,then i take dolipran be pregnant but not yet in project if it doe not prevent over fertil,44
6325,are there new in term of reimburs for havrix 720 or is he alway repaid that in cystic fibrosi and liver diseas,47
